{
  "schema_version": 1,
  "id": "cake-wallet-nano-bip39-create-android",
  "display_name": {
    "en": "Cake Wallet nano — bip39-create (android)",
    "ru": "Cake Wallet nano — bip39-create (android)"
  },
  "status": "documented",
  "historical": false,
  "evidence_ids": [
    "cake-wallet-inventory",
    "cake-wallet-nano-service",
    "cake-wallet-nano-doc",
    "cake-wallet-build-android",
    "cake-wallet-version-android",
    "cake-wallet-create-ui",
    "cake-wallet-lock",
    "cake-wallet-bip39-pbkdf",
    "cake-wallet-nano-derive",
    "cake-wallet-nano-dependency"
  ],
  "verified_on": "2026-09-29",
  "version_interval": {
    "min": "source-9679f91a8c9f63d00500c2b7cc18daf00949bdef",
    "max": "source-9679f91a8c9f63d00500c2b7cc18daf00949bdef"
  },
  "product_id": "cake-wallet",
  "product_name": "Cake Wallet",
  "aliases": [],
  "platform": "android",
  "mode_id": "nano-bip39-create",
  "network_ids": [
    "nano"
  ],
  "scheme_id": "cake-nano-hd-create",
  "generates_mnemonic": true,
  "import_only": false,
  "limitations": [
    "English HD Nano12/24 creation; dependency import five lengths. Credentials passphrase is dropped and derivation uses fixed mnemonic salt, not an optional BIP39 extension. ",
    "Source-bound research only: non-selectable; no installed binary, independent wallet recovery, hardware transport, signing or Windows release approval. Match original wallet platform/version/mode and use its own backup procedure."
  ],
  "guidance": "Use the original wallet backup procedure. Never enter a complete phrase, private key or recovery passphrase into Tessaveil."
}
