{
  "schema_version": 1,
  "id": "cake-wallet-monero-legacy-fr-import-macos",
  "display_name": {
    "en": "Cake Wallet monero — legacy-fr-import (macos)",
    "ru": "Cake Wallet monero — legacy-fr-import (macos)"
  },
  "status": "documented",
  "historical": false,
  "evidence_ids": [
    "cake-wallet-language-ui",
    "cake-wallet-monero-service",
    "cake-wallet-build-macos"
  ],
  "verified_on": "2026-09-29",
  "version_interval": {
    "min": "source-9679f91a8c9f63d00500c2b7cc18daf00949bdef",
    "max": "source-9679f91a8c9f63d00500c2b7cc18daf00949bdef"
  },
  "product_id": "cake-wallet",
  "product_name": "Cake Wallet",
  "aliases": [],
  "platform": "macos",
  "mode_id": "monero-legacy-fr-import",
  "network_ids": [
    "monero"
  ],
  "scheme_id": "cake-monero-legacy-fr",
  "generates_mnemonic": false,
  "import_only": true,
  "limitations": [
    "Explicit fr list, 25 words. Selector-backed creation; restored language recognition/native dependency and wallet recovery remain unverified. Optional external seed passphrase; not wallet unlock password.",
    "Source-bound research only: non-selectable; no installed binary, independent wallet recovery, hardware transport, signing or Windows release approval. Match original wallet platform/version/mode and use its own backup procedure."
  ],
  "guidance": "Use the original wallet backup procedure. Never enter a complete phrase, private key or recovery passphrase into Tessaveil."
}
