{
  "schema_version": 1,
  "id": "cake-wallet-monero-bip39-group-ios",
  "display_name": {
    "en": "Cake Wallet monero — bip39-group (ios)",
    "ru": "Cake Wallet monero — bip39-group (ios)"
  },
  "status": "documented",
  "historical": false,
  "evidence_ids": [
    "cake-wallet-inventory",
    "cake-wallet-monero-service",
    "cake-wallet-monero-doc",
    "cake-wallet-build-ios",
    "cake-wallet-version-ios",
    "cake-wallet-create-ui",
    "cake-wallet-lock",
    "cake-wallet-bip39-pbkdf",
    "cake-wallet-groups",
    "cake-wallet-monero-bip39-derive"
  ],
  "verified_on": "2026-09-29",
  "version_interval": {
    "min": "source-9679f91a8c9f63d00500c2b7cc18daf00949bdef",
    "max": "source-9679f91a8c9f63d00500c2b7cc18daf00949bdef"
  },
  "product_id": "cake-wallet",
  "product_name": "Cake Wallet",
  "aliases": [],
  "platform": "ios",
  "mode_id": "monero-bip39-group",
  "network_ids": [
    "monero"
  ],
  "scheme_id": "cake-monero-bip39-import",
  "generates_mnemonic": false,
  "import_only": true,
  "limitations": [
    "English fresh12; group/import accepts locked BIP39 lengths12/15/18/21/24. Path hardened 44, hardened 128, hardened account, then 0 and 0 then little-endian scalar reduction; missing NFKD means Unicode extension compatibility blocked. ",
    "Source-bound research only: non-selectable; no installed binary, independent wallet recovery, hardware transport, signing or Windows release approval. Match original wallet platform/version/mode and use its own backup procedure."
  ],
  "guidance": "Use the original wallet backup procedure. Never enter a complete phrase, private key or recovery passphrase into Tessaveil."
}
