{
  "schema_version": 1,
  "id": "cake-wallet-bnb-chain-hardware-ios",
  "display_name": {
    "en": "Cake Wallet bnb-chain — hardware (ios)",
    "ru": "Cake Wallet bnb-chain — hardware (ios)"
  },
  "status": "documented",
  "historical": false,
  "evidence_ids": [
    "cake-wallet-inventory",
    "cake-wallet-bnb-chain-service",
    "cake-wallet-bnb-chain-doc",
    "cake-wallet-build-ios",
    "cake-wallet-version-ios",
    "cake-wallet-restore-ui"
  ],
  "verified_on": "2026-09-29",
  "version_interval": {
    "min": "source-9679f91a8c9f63d00500c2b7cc18daf00949bdef",
    "max": "source-9679f91a8c9f63d00500c2b7cc18daf00949bdef"
  },
  "product_id": "cake-wallet",
  "product_name": "Cake Wallet",
  "aliases": [],
  "platform": "ios",
  "mode_id": "bnb-chain-hardware",
  "network_ids": [
    "bnb-chain"
  ],
  "scheme_id": null,
  "generates_mnemonic": false,
  "import_only": true,
  "limitations": [
    "External hardware signer route; Cake does not generate that signer backup. Device/model/transport/firmware/OS compatibility unverified; never infer device mnemonic list from this route. ",
    "Source-bound research only: non-selectable; no installed binary, independent wallet recovery, hardware transport, signing or Windows release approval. Match original wallet platform/version/mode and use its own backup procedure."
  ],
  "guidance": "Use the original wallet backup procedure. Never enter a complete phrase, private key or recovery passphrase into Tessaveil."
}
