{
  "schema_version": 1,
  "id": "cake-wallet-base-bip39-group-macos",
  "display_name": {
    "en": "Cake Wallet base — bip39-group (macos)",
    "ru": "Cake Wallet base — bip39-group (macos)"
  },
  "status": "documented",
  "historical": false,
  "evidence_ids": [
    "cake-wallet-inventory",
    "cake-wallet-base-service",
    "cake-wallet-base-doc",
    "cake-wallet-build-macos",
    "cake-wallet-version-macos",
    "cake-wallet-create-ui",
    "cake-wallet-lock",
    "cake-wallet-bip39-pbkdf",
    "cake-wallet-groups"
  ],
  "verified_on": "2026-09-29",
  "version_interval": {
    "min": "source-9679f91a8c9f63d00500c2b7cc18daf00949bdef",
    "max": "source-9679f91a8c9f63d00500c2b7cc18daf00949bdef"
  },
  "product_id": "cake-wallet",
  "product_name": "Cake Wallet",
  "aliases": [],
  "platform": "macos",
  "mode_id": "base-bip39-group",
  "network_ids": [
    "base"
  ],
  "scheme_id": "cake-bip39-import",
  "generates_mnemonic": false,
  "import_only": true,
  "limitations": [
    "English vocabulary; only exact pinned source route is described. Fresh creation12/24 differs from dependency import12/15/18/21/24. Optional passphrase uses the locked dependency without NFKD; no universal path compatibility. Existing group mnemonic reused, not newly generated. ",
    "Source-bound research only: non-selectable; no installed binary, independent wallet recovery, hardware transport, signing or Windows release approval. Match original wallet platform/version/mode and use its own backup procedure."
  ],
  "guidance": "Use the original wallet backup procedure. Never enter a complete phrase, private key or recovery passphrase into Tessaveil."
}
