{
  "schema_version": 1,
  "id": "cake-wallet-monero-polyseed-encrypted-cs-import-ios",
  "display_name": {
    "en": "Cake Monero Polyseed cs — encrypted restore (ios)",
    "ru": "Cake Monero Polyseed cs — encrypted restore (ios)"
  },
  "status": "documented",
  "historical": false,
  "evidence_ids": [
    "cake-wallet-language-ui",
    "cake-wallet-polyseed-dispatch",
    "cake-wallet-build-ios"
  ],
  "verified_on": "2026-09-29",
  "version_interval": {
    "min": "source-9679f91a8c9f63d00500c2b7cc18daf00949bdef",
    "max": "source-9679f91a8c9f63d00500c2b7cc18daf00949bdef"
  },
  "product_id": "cake-wallet",
  "product_name": "Cake Wallet",
  "aliases": [],
  "platform": "ios",
  "mode_id": "monero-polyseed-encrypted-cs-import",
  "network_ids": [
    "monero"
  ],
  "scheme_id": "cake-monero-polyseed-encrypted-cs",
  "generates_mnemonic": false,
  "import_only": true,
  "limitations": [
    "Condition: isEncrypted=true. Input dictionary polyseed-cs,16 words. polyseed.crypt(passphrase or empty) first, then polyseed.generateKey(POLYSEED_MONERO,32) and restoreWalletFromSpendKeySync. Source permits an empty input; the encrypted flag selects this operation regardless of whether a nonempty passphrase was supplied. Not a native seed offset. Source route only; exact native/dependency parity, Unicode normalization and independent wallet recovery unverified.",
    "Source-bound research only: non-selectable; no installed binary, independent wallet recovery, hardware transport, signing or Windows release approval. Match original wallet platform/version/mode and use its own backup procedure."
  ],
  "guidance": "Use the original wallet backup procedure. Never enter a complete phrase, private key or recovery passphrase into Tessaveil."
}
