{
  "schema_version": 1,
  "id": "cake-wallet-litecoin-view-only-macos",
  "display_name": {
    "en": "Cake Wallet litecoin — view-only (macos)",
    "ru": "Cake Wallet litecoin — view-only (macos)"
  },
  "status": "documented",
  "historical": false,
  "evidence_ids": [
    "cake-wallet-inventory",
    "cake-wallet-litecoin-service",
    "cake-wallet-litecoin-doc",
    "cake-wallet-build-macos",
    "cake-wallet-version-macos",
    "cake-wallet-restore-ui"
  ],
  "verified_on": "2026-09-29",
  "version_interval": {
    "min": "source-9679f91a8c9f63d00500c2b7cc18daf00949bdef",
    "max": "source-9679f91a8c9f63d00500c2b7cc18daf00949bdef"
  },
  "product_id": "cake-wallet",
  "product_name": "Cake Wallet",
  "aliases": [],
  "platform": "macos",
  "mode_id": "litecoin-view-only",
  "network_ids": [
    "litecoin"
  ],
  "scheme_id": null,
  "generates_mnemonic": false,
  "import_only": true,
  "limitations": [
    "Watch-only/public or view-key restore; spending authority remains external. Litecoin may require scanSecret/spendPubkey. ",
    "Source-bound research only: non-selectable; no installed binary, independent wallet recovery, hardware transport, signing or Windows release approval. Match original wallet platform/version/mode and use its own backup procedure."
  ],
  "guidance": "Use the original wallet backup procedure. Never enter a complete phrase, private key or recovery passphrase into Tessaveil."
}
