{
  "schema_version": 1,
  "id": "cake-wallet-arbitrum-bip39-create-ios",
  "display_name": {
    "en": "Cake Wallet arbitrum — bip39-create (ios)",
    "ru": "Cake Wallet arbitrum — bip39-create (ios)"
  },
  "status": "documented",
  "historical": false,
  "evidence_ids": [
    "cake-wallet-inventory",
    "cake-wallet-arbitrum-service",
    "cake-wallet-arbitrum-doc",
    "cake-wallet-build-ios",
    "cake-wallet-version-ios",
    "cake-wallet-create-ui",
    "cake-wallet-lock",
    "cake-wallet-bip39-pbkdf"
  ],
  "verified_on": "2026-09-29",
  "version_interval": {
    "min": "source-9679f91a8c9f63d00500c2b7cc18daf00949bdef",
    "max": "source-9679f91a8c9f63d00500c2b7cc18daf00949bdef"
  },
  "product_id": "cake-wallet",
  "product_name": "Cake Wallet",
  "aliases": [],
  "platform": "ios",
  "mode_id": "arbitrum-bip39-create",
  "network_ids": [
    "arbitrum"
  ],
  "scheme_id": "cake-bip39-create",
  "generates_mnemonic": true,
  "import_only": false,
  "limitations": [
    "English vocabulary; only exact pinned source route is described. Fresh creation12/24 differs from dependency import12/15/18/21/24. Optional passphrase uses the locked dependency without NFKD; no universal path compatibility. ",
    "Source-bound research only: non-selectable; no installed binary, independent wallet recovery, hardware transport, signing or Windows release approval. Match original wallet platform/version/mode and use its own backup procedure."
  ],
  "guidance": "Use the original wallet backup procedure. Never enter a complete phrase, private key or recovery passphrase into Tessaveil."
}
