{
  "schema_version": 1,
  "id": "cake-wallet-wownero-polyseed16-export-ios",
  "display_name": {
    "en": "Cake Wallet wownero — polyseed16-export (ios)",
    "ru": "Cake Wallet wownero — polyseed16-export (ios)"
  },
  "status": "documented",
  "historical": true,
  "evidence_ids": [
    "cake-wallet-wownero-doc",
    "cake-wallet-inventory",
    "cake-wallet-build-ios"
  ],
  "verified_on": "2026-09-29",
  "version_interval": {
    "min": "source-9679f91a8c9f63d00500c2b7cc18daf00949bdef",
    "max": "source-9679f91a8c9f63d00500c2b7cc18daf00949bdef"
  },
  "product_id": "cake-wallet",
  "product_name": "Cake Wallet",
  "aliases": [],
  "platform": "ios",
  "mode_id": "wownero-polyseed16-export",
  "network_ids": [
    "wownero"
  ],
  "scheme_id": null,
  "generates_mnemonic": false,
  "import_only": false,
  "limitations": [
    "Historical wallet export only; creation/restore/sync/transact removed. Exact original generation version, language/dependency/normalization remain unresolved; no Monero coin-domain substitution.",
    "Source-bound research only: non-selectable; no installed binary, independent wallet recovery, hardware transport, signing or Windows release approval. Match original wallet platform/version/mode and use its own backup procedure."
  ],
  "guidance": "Use the original wallet backup procedure. Never enter a complete phrase, private key or recovery passphrase into Tessaveil."
}
