{
  "schema_version": 1,
  "id": "cosmostation",
  "display_name": {
    "en": "Cosmostation — mnemonic-generated",
    "ru": "Cosmostation — mnemonic-generated"
  },
  "status": "documented",
  "historical": false,
  "evidence_ids": [
    "wallet-cosmostation-source"
  ],
  "verified_on": "2026-09-29",
  "version_interval": {
    "min": "278e29ab131cff4dda2ac2700863108d3b25e36a",
    "max": "278e29ab131cff4dda2ac2700863108d3b25e36a"
  },
  "product_id": "cosmostation",
  "product_name": "Cosmostation",
  "aliases": [],
  "platform": "web",
  "mode_id": "mnemonic-generated",
  "network_ids": [
    "cosmos"
  ],
  "scheme_id": "bip39",
  "generates_mnemonic": true,
  "import_only": false,
  "limitations": [
    "Pinned extension UI calls bip39.generateMnemonic with 128/192/256-bit choices for 12/18/24 words; password encrypts stored mnemonic. Package/binary recovery binding remains unverified.",
    "Non-selectable. The singleton source/document boundary is not a supported release interval. No shipped-binary binding, independent wallet recovery, unlisted platform or network compatibility has been verified. A false generation flag means generation is not claimed for this mode; it does not prove absence."
  ],
  "guidance": "Use the original trusted wallet's backup procedure; match exact product, version, platform, network and mode. Local unlock passwords, cloud credentials and passphrases are separate dependencies. Never enter full phrases, private keys or external secrets into Tessaveil."
}
