{
  "schema_version": 1,
  "id": "trezor-model-t-multi-share",
  "display_name": {
    "en": "Trezor Model T — suite-multi-share-20-created",
    "ru": "Trezor Model T — suite-multi-share-20-created"
  },
  "status": "documented",
  "historical": false,
  "evidence_ids": [
    "slip39-trezor-model-t"
  ],
  "verified_on": "2026-09-29",
  "version_interval": {
    "min": "suite-firmware-version-unresolved-doc-2026-09-29",
    "max": "suite-firmware-version-unresolved-doc-2026-09-29"
  },
  "product_id": "trezor-model-t",
  "product_name": "Trezor Model T",
  "aliases": [],
  "platform": "hardware",
  "mode_id": "suite-multi-share-20-created",
  "network_ids": [
    "multi-chain"
  ],
  "scheme_id": "slip39-share-20",
  "generates_mnemonic": true,
  "import_only": false,
  "limitations": [
    "12-word BIP39 is default; SLIP39 is an explicit choice. Hardware platform only; Suite host OS/version and firmware bounds unresolved. No promise for all firmware, Model One, 33-word Suite creation or CLI advanced groups. See exact device row.",
    "Non-selectable: exact released-artifact binding and independent wallet recovery have not been verified. A dated unresolved-version marker is not a release interval; false generation means no generation claim for this specific record, not proof of absence."
  ],
  "guidance": "Use the original trusted wallet backup/recovery procedure. Match product, platform, exact version and specific mode. Never enter a complete phrase/share or extra passphrase into Tessaveil."
}
